<?xml version="1.0" encoding="UTF-8"?>
<!--
 Licensed to the Apache Software Foundation (ASF) under one or more
 contributor license agreements.  See the NOTICE file distributed with
 this work for additional information regarding copyright ownership.
 The ASF licenses this file to You under the Apache License, Version 2.0
 (the "License"); you may not use this file except in compliance with
 the License.  You may obtain a copy of the License at

      http://www.apache.org/licenses/LICENSE-2.0

 Unless required by applicable law or agreed to in writing, software
 distributed under the License is distributed on an "AS IS" BASIS,
 WITHOUT WARRANTIES OR CONDITIONS OF ANY KIND, either express or implied.
 See the License for the specific language governing permissions and
 limitations under the License.
-->
<xs:schema xmlns:xs="http://www.w3.org/2001/XMLSchema"
           targetNamespace="http://maven.apache.org/PLUGIN-PARAMETERS/1.0.0"
           xmlns="http://maven.apache.org/PLUGIN-PARAMETERS/1.0.0"
           elementFormDefault="qualified">

  <xs:element name="plugin" type="PluginType"/>
  <xs:element name="plugins" type="PluginsType"/>

  <xs:complexType name="PluginsType">
    <xs:sequence>
      <xs:element ref="plugin" maxOccurs="unbounded"/>
    </xs:sequence>
  </xs:complexType>

  <xs:complexType name="PluginType">
    <xs:sequence>
      <xs:element name="groupId" type="xs:string"/>
      <xs:element name="artifactId" type="xs:string"/>
      <xs:element name="minVersion" type="xs:string" minOccurs="0"/>
      <xs:element name="goals" type="GoalsType"/>
    </xs:sequence>
  </xs:complexType>

  <xs:complexType name="GoalsType">
    <xs:sequence>
      <xs:element name="goal" type="GoalType" maxOccurs="unbounded"/>
    </xs:sequence>
  </xs:complexType>

  <xs:complexType name="GoalType">
    <xs:sequence>
      <xs:element name="name" type="xs:string"/>
      <xs:element name="parameters" type="ParametersType"/>
    </xs:sequence>
  </xs:complexType>

  <xs:complexType name="ParametersType">
    <xs:sequence>
      <xs:element name="parameter" type="ParameterType" maxOccurs="unbounded"/>
    </xs:sequence>
  </xs:complexType>

  <xs:complexType name="ParameterType">
    <xs:sequence>
      <xs:element name="name" type="xs:string"/>
      <xs:element name="type" type="ParameterTypeEnum"/>
      <xs:element name="description" type="xs:string" minOccurs="0"/>
    </xs:sequence>
  </xs:complexType>

  <xs:simpleType name="ParameterTypeEnum">
    <xs:restriction base="xs:string">
      <xs:enumeration value="functional"/>
      <xs:enumeration value="behavioral"/>
    </xs:restriction>
  </xs:simpleType>

</xs:schema>
