<?xml version="1.0" encoding="UTF-8"?>
<!--
 Licensed to the Apache Software Foundation (ASF) under one or more
 contributor license agreements.  See the NOTICE file distributed with
 this work for additional information regarding copyright ownership.
 The ASF licenses this file to You under the Apache License, Version 2.0
 (the "License"); you may not use this file except in compliance with
 the License.  You may obtain a copy of the License at

      http://www.apache.org/licenses/LICENSE-2.0

 Unless required by applicable law or agreed to in writing, software
 distributed under the License is distributed on an "AS IS" BASIS,
 WITHOUT WARRANTIES OR CONDITIONS OF ANY KIND, either express or implied.
 See the License for the specific language governing permissions and
 limitations under the License.
-->
<!--
  Test plugin demonstrating version-specific parameter definitions.
  This file shows how parameters change across plugin versions.
-->
<plugins xmlns="http://maven.apache.org/PLUGIN-PARAMETERS/1.0.0">
  <!-- Parameters for version 1.0.0-2.9.9 -->
  <plugin xmlns="http://maven.apache.org/PLUGIN-PARAMETERS/1.0.0"
          xmlns:xsi="http://www.w3.org/2001/XMLSchema-instance"
          xsi:schemaLocation="http://maven.apache.org/PLUGIN-PARAMETERS/1.0.0 plugin-parameters.xsd">
    <groupId>org.apache.maven.plugins</groupId>
    <artifactId>maven-versioned-plugin</artifactId>
    <minVersion>1.0.0</minVersion>
    <goals>
      <goal>
        <name>execute</name>
        <parameters>
          <parameter>
            <name>legacyParameter</name>
            <type>functional</type>
            <description>Parameter available only in 1.x versions</description>
          </parameter>
          <parameter>
            <name>commonParameter</name>
            <type>functional</type>
            <description>Parameter available in all versions</description>
          </parameter>
        </parameters>
      </goal>
    </goals>
  </plugin>

  <!-- Parameters for version 3.0.0+ -->
  <plugin xmlns="http://maven.apache.org/PLUGIN-PARAMETERS/1.0.0">
    <groupId>org.apache.maven.plugins</groupId>
    <artifactId>maven-versioned-plugin</artifactId>
    <minVersion>3.0.0</minVersion>
    <goals>
      <goal>
        <name>execute</name>
        <parameters>
          <parameter>
            <name>newParameter</name>
            <type>functional</type>
            <description>Parameter added in version 3.0.0</description>
          </parameter>
          <parameter>
            <name>commonParameter</name>
            <type>functional</type>
            <description>Parameter available in all versions</description>
          </parameter>
        </parameters>
      </goal>
    </goals>
  </plugin>
</plugins>
