<?xml version="1.0" encoding="UTF-8"?>
<!--
 Licensed to the Apache Software Foundation (ASF) under one or more
 contributor license agreements.  See the NOTICE file distributed with
 this work for additional information regarding copyright ownership.
 The ASF licenses this file to You under the Apache License, Version 2.0
 (the "License"); you may not use this file except in compliance with
 the License.  You may obtain a copy of the License at

      http://www.apache.org/licenses/LICENSE-2.0

 Unless required by applicable law or agreed to in writing, software
 distributed under the License is distributed on an "AS IS" BASIS,
 WITHOUT WARRANTIES OR CONDITIONS OF ANY KIND, either express or implied.
 See the License for the specific language governing permissions and
 limitations under the License.
-->
<!-- Test plugin with version 1.0.0 parameters (deprecated 'oldParameter') -->
<plugin xmlns="http://maven.apache.org/PLUGIN-PARAMETERS/1.0.0"
        xmlns:xsi="http://www.w3.org/2001/XMLSchema-instance"
        xsi:schemaLocation="http://maven.apache.org/PLUGIN-PARAMETERS/1.0.0 plugin-parameters.xsd">
  <groupId>org.apache.maven.plugins</groupId>
  <artifactId>maven-test-plugin</artifactId>
  <goals>
    <goal>
      <name>test</name>
      <parameters>
        <parameter>
          <name>commonParameter</name>
          <cache-key>true</cache-key>
          <description>Parameter available in all versions; changing it changes the test result</description>
        </parameter>
        <parameter>
          <name>oldParameter</name>
          <cache-key>true</cache-key>
          <description>Parameter only in 1.x versions; changing it changes the test result</description>
        </parameter>
      </parameters>
    </goal>
  </goals>
</plugin>
