<?xml version="1.0" encoding="UTF-8"?>
<!--
 Licensed to the Apache Software Foundation (ASF) under one or more
 contributor license agreements.  See the NOTICE file distributed with
 this work for additional information regarding copyright ownership.
 The ASF licenses this file to You under the Apache License, Version 2.0
 (the "License"); you may not use this file except in compliance with
 the License.  You may obtain a copy of the License at

      http://www.apache.org/licenses/LICENSE-2.0

 Unless required by applicable law or agreed to in writing, software
 distributed under the License is distributed on an "AS IS" BASIS,
 WITHOUT WARRANTIES OR CONDITIONS OF ANY KIND, either express or implied.
 See the License for the specific language governing permissions and
 limitations under the License.
-->
<plugin xmlns="http://maven.apache.org/PLUGIN-PARAMETERS/1.0.0"
        xmlns:xsi="http://www.w3.org/2001/XMLSchema-instance"
        xsi:schemaLocation="http://maven.apache.org/PLUGIN-PARAMETERS/1.0.0 plugin-parameters.xsd">
  <groupId>org.apache.maven.plugins</groupId>
  <artifactId>maven-install-plugin</artifactId>
  <minVersion>3.1.1</minVersion>

  <goals>
    <goal>
      <name>install</name>
      <parameters>
        <!-- FUNCTIONAL: Skipping installation changes the produced local repository -->
        <parameter>
          <name>skip</name>
          <type>functional</type>
          <description>Skip installation</description>
        </parameter>

        <!-- FUNCTIONAL: Affect installed artifacts or project state -->
        <parameter>
          <name>installAtEnd</name>
          <type>functional</type>
          <description>Install artifacts at end of multi-module build (changes installed project state on failure)</description>
        </parameter>
      </parameters>
    </goal>

    <goal>
      <name>install-file</name>
      <parameters>
        <!-- Same parameters as install goal -->
        <parameter>
          <name>file</name>
          <type>functional</type>
          <description>The file to install</description>
        </parameter>
        <parameter>
          <name>groupId</name>
          <type>functional</type>
          <description>GroupId of the artifact</description>
        </parameter>
        <parameter>
          <name>artifactId</name>
          <type>functional</type>
          <description>ArtifactId of the artifact</description>
        </parameter>
        <parameter>
          <name>version</name>
          <type>functional</type>
          <description>Version of the artifact</description>
        </parameter>
        <parameter>
          <name>packaging</name>
          <type>functional</type>
          <description>Packaging type of the artifact</description>
        </parameter>
        <parameter>
          <name>classifier</name>
          <type>functional</type>
          <description>Classifier of the artifact</description>
        </parameter>
        <parameter>
          <name>pomFile</name>
          <type>functional</type>
          <description>POM file to install</description>
        </parameter>
        <parameter>
          <name>generatePom</name>
          <type>functional</type>
          <description>Generate a minimal POM</description>
        </parameter>
        <parameter>
          <name>javadoc</name>
          <type>functional</type>
          <description>Javadoc artifact to install</description>
        </parameter>
        <parameter>
          <name>localRepositoryPath</name>
          <type>functional</type>
          <description>Local repository path</description>
        </parameter>
        <parameter>
          <name>sources</name>
          <type>functional</type>
          <description>Sources artifact to install</description>
        </parameter>
      </parameters>
    </goal>
  </goals>
</plugin>
